<?xml version="1.0" encoding="UTF-8"?>
<!ELEMENT mapaEstelar (constelacion,estrella)>
<!ATTLIST mapaEstelar xmlns:xsi CDATA #IMPLIED
xsi:noNamespaceSchemaLocation CDATA #IMPLIED>
<!ELEMENT constelacion (#PCDATA|nombreEspanol|superficie|estrellas|objetos|colindantes|observacion)*>
<!ATTLIST constelacion nombreLatin CDATA #IMPLIED>
<!ELEMENT nombreEspanol (#PCDATA)>
<!ELEMENT superficie (#PCDATA)>
<!ELEMENT estrellas (asterismo,masBrillante)>
<!ATTLIST estrellas numero CDATA #REQUIRED>
<!ELEMENT asterismo (#PCDATA)>
<!ELEMENT masBrillante (nombreEstrella)>
<!ATTLIST masBrillante luminosidad CDATA "soles" >
<!ELEMENT nombreEstrella (#PCDATA)>
<!ELEMENT objetos (cumulos,nebulosas,galaxias,cuasares,lluviaDeMeteoros*)>
<!ELEMENT cumulos (#PCDATA)>
<!ELEMENT nebulosas (#PCDATA)>
<!ELEMENT galaxias (#PCDATA)>
<!ELEMENT cuasares (#PCDATA)>
<!ELEMENT lluviaDeMeteoros (#PCDATA)>
<!ELEMENT colindantes (nombre+)>
<!ELEMENT nombre (#PCDATA)>
<!ELEMENT observacion (hemisferio,mes,hora)>
<!ELEMENT hemisferio (#PCDATA)>
<!ELEMENT mes (#PCDATA)>
<!ELEMENT hora (#PCDATA)>
<!ELEMENT estrella (nombre,constelacion,distancia,luminosidad,temperatura,masa)>
<!ELEMENT const (#PCDATA)>
<!ELEMENT distancia (#PCDATA)>
<!ATTLIST distancia medida CDATA #FIXED "aÃ±os luz">
<!ELEMENT luminosidad (#PCDATA)>
<!ATTLIST luminosidad medida CDATA "soles">
<!ELEMENT temperatura (#PCDATA)>
<!ATTLIST temperatura medida CDATA "K">
<!ELEMENT masa (#PCDATA)>
<!ATTLIST masa medida CDATA "soles">
